{
  "id": "82d86e05-9ee0-44ca-9a8d-1fc6f719437e",
  "request": {
    "method": "GET"
  },
  "response": {
    "status": 200,
    "jsonBody": {
      "name": "john",
      "age": 42,
      "candidate": true,
      "surnames": [
        "jdoe",
        "johnny"
      ]
    }
  },
  "uuid": "82d86e05-9ee0-44ca-9a8d-1fc6f719437e"
}
